Serial ID,Sentence,x,y
1541-0,Will there be a **lethal confrontation involving the **national military forces of one or more countries in the Gulf of Aden **between 29 April and 10 June 2015?,26.6767,-1.93582
1542-0,"Will Japan's Nikkei 225 Index close at or above 21,000.00 **between 29 April and 10 June 2015?",-12.4434,-21.0856
1543-0,Will Syria's President Bashar al-Assad *vacate office **before 10 June 2015?,-17.98,24.5291
1544-0,"Will the closing spot price of gold fall to $1,150.00 or below **between 29 April and 10 June 2015?",-12.1015,-22.0571
5001-0,Will Ecuador grant Edward Snowden's request for asylum prior to 31 July 2013?,2.81006,-1.82674
5002-0,Who will win the next presidential election in Mali?,-24.6513,-4.15991
5003-0,Will Chinese armed forces or maritime law enforcement forces attempt to interdict at least one U.S. government naval vessel or airplane that it claims is in its territorial waters or airspace before 31 July 2013?,27.1273,-2.9241
5004-0,Who will win the Tour de France?,-24.8192,-5.57027
5005-6,"How will the opening-weekend US domestic box office for the film ""The Wolverine"" compare to the US domestic box office for ""Origins: Wolverine""? ",-18.223,16.3973
5007-0,"Will US nonfarm payroll employment increase by more than 175,000 workers in July 2013 compared to June 2013?",-5.09915,-15.623
5008-0,Will the Denver Broncos win Super Bowl XLVIII?  (Just for fun question -- not included in official scoring),-8.52924,-11.9572
5009-0,Super Bowl XLVIII: Will the margin of victory exceed 3 points?  (Just for fun question -- not included in official scoring),5.18722,17.777
5101-0,Who will win the PGA Championship in August 2014?,-25.4829,-5.47694
5102-0,Will Recep Tayyip Erdogan win Turkey's 2014 presidential **election?,-26.9002,-4.51296
5103-0,Will Apple **officially announce the first U.S. release date for iPhone 6 **before 20 August 2014? ,-11.9017,2.8954
5104-0,"**Before 20 August 2014, will 21st Century Fox purchase a majority share in Time Warner?",4.1886,-4.26113
5105-0,Will it be **officially announced that Kate Middleton is pregnant with her second child **by 20 August 2014?,-4.02478,10.1718
5106-0,"Will Tian Tian, the Giant Panda, give birth **before 20 August 2014?",-8.43205,6.88634
5107-6,"What will be the U.S. box office gross for the movie ""Teenage Mutant Ninja Turtles"" on its 2014 opening weekend?",-18.7483,15.76
5108-0,"Will the Dow Jones Industrial Average daily closing value exceed 17,000 on 18 August 2014?",-10.6108,-17.973
5109-0,Will Malaysia Airlines *officially file for bankruptcy on or **before 20 August 2014?,-5.23362,9.22512
5110-6,How many games will the Boston Red Sox be out of first place in the AL East after their game on 19 August 2014?,1.20899,-15.4517
6379-0,Will Yingluck Shinawatra vacate the office of Prime Minister of Thailand before 1 May 2014?,-22.9495,23.2126
6413-0,Will the Kurdistan Regional Government *hold a referendum on national independence <b>**before 10 June 2015</b>?,-12.7215,1.27693
