Serial ID,Sentence,x,y
1338-1,Will South Korea announce its intention to join the Trans-Pacific Partnership (TPP) negotiations before 31 January 2014? ,15.813,-19.6389
1338-2,Will South Korea announce its intention to join the Trans-Pacific Partnership (TPP) negotiations before 31 January 2014? ,15.6577,-19.8667
1339-6,What will be the number of registered Syrian refugees reported by the UNHCR as of 1 April 2014?,2.7355,-17.7726
1340-0,Will Israel release all of the 104 Palestinian prisoners from its jails before 1 May 2014? ,4.63109,-17.8702
1341-0,Will Thailand *commence parliamentary elections on or before 2 February 2014? ,-20.0116,1.46532
1342-0,Will inflation in Japan reach 2 percent at any point before 1 April 2014? ,-11.7398,-12.3238
1343-6,What will be the highest reported monthly average of Mexican oil exports to the United States between 5 February 2014 and 1 April 2014?,-8.71591,-21.5631
1344-0,Will the U.N. Security Council approve a U.N. peacekeeping operation for the Central African Republic before 1 April 2014?,16.7891,-8.09583
1345-1,Will negotiations on the TransPacific Partnership (TPP) *officially conclude before 1 May 2014? ,13.3652,-21.3399
1345-2,Will negotiations on the TransPacific Partnership (TPP) *officially conclude before 1 May 2014? ,16.3564,-21.1804
1347-1,Will Viktor Yanukovich vacate the office of President of Ukraine before 10 May 2014?,-19.5492,20.9349
1347-2,Will Viktor Yanukovich vacate the office of President of Ukraine before 10 May 2014?,-16.9036,19.4382
1348-0,Will Ukraine *officially declare a state of emergency before 10 May 2014?,6.55455,1.4163
1349-0,Will there be a *lethal confrontation between national military forces from China and Japan before 1 May 2014?,27.3661,-1.93946
1350-0,"Before 1 May 2014, will China confiscate the catch or equipment of any foreign fishing vessels in the South China Sea for failing to obtain prior permission to enter those waters?",28.0551,-2.01279
1351-0,"Before 1 May 2014, will Iran install any new *centrifuges?",10.4788,0.86528
1352-0,Will there be a *significant attack on *Israeli territory before 10 May 2014? ,25.5833,7.34306
1353-0,Will the Israeli-Palestinian peace talks be extended beyond 29 April 2014?,2.64472,14.3007
1354-0,"Before 1 April 2014, will the government of Venezuela *officially announce a reduction in government subsidies for gasoline prices?",-3.03735,8.79389
1355-1,"Before 1 May 2014, will Kenneth Bae leave North Korea?",16.2071,2.47053
1355-2,"Before 1 May 2014, will Kenneth Bae leave North Korea?",16.2071,2.47053
1357-0,Which party will win the largest number of seats in the next elections for Colombia's Chamber of Representatives?,-21.4474,-1.46242
1358-0,"Before 1 May 2014, will China *attempt to seize control of Zhongye Island?",28.5163,-3.024
1359-6,Which of the following will occur first with regard to the state of emergency declared by the government of Thailand on 21 January 2014?,3.3501,-2.83539
1360-0,What will be the outcome of Mohammed Morsi's trial on the charge of espionage?,-7.92156,-14.6249
1361-6,How many *additional countries will announce *restrictions on financial institutions and/or businesses converting Bitcoin to conventional currencies between 19 February 2014 and 30 April 2014?,3.94535,-18.0115
1363-6,How many people in the Central African Republic will be estimated as internally displaced by the U.N. High Commissioner for Refugees (UNHCR) as of 1 May 2014?,0.947189,-18.4173
1366-0,Will the Bank of Japan (BoJ) *officially announce an *enhancement of its quantitative and qualitative monetary easing (QQE) policy before 10 May 2014?,3.95009,-12.5335
1367-1,Will the European Central Bank (ECB) *officially announce a plan to charge a *negative interest rate on funds parked overnight at the ECB before 31 March 2014?,15.4404,-21.8128
1367-2,Will the European Central Bank (ECB) *officially announce a plan to charge a *negative interest rate on funds parked overnight at the ECB before 31 March 2014?,15.4949,-22.2368
1368-0,Will Pakistan and the TTP reach a peace agreement before 10 May 2014?,-12.4983,17.7571
1369-1,"Before 1 March 2014, will Russia purchase any *additional Ukrainian government bonds?",10.4989,-0.0400081
1369-2,"Before 1 March 2014, will Russia purchase any *additional Ukrainian government bonds?",10.3968,-0.569574
1370-1,Will family reunions between South and North Korea begin on or before 25 February 2014? ,5.70878,21.4409
1370-2,Will family reunions between South and North Korea begin on or before 25 February 2014? ,6.25492,20.8097
1371-1,"Before 1 May 2014, will North Korea conduct a new *multistage rocket or missile *launch?",14.4445,2.69259
1371-2,"Before 1 May 2014, will North Korea conduct a new *multistage rocket or missile *launch?",14.8196,2.67432
1372-0,Will Syria's *mustard agent and key binary chemical weapon components be destroyed on or before the 31 March 2014 deadline established by the Executive Council of the Organization for the Prohibition of Chemical Weapons (OPCW)?,16.7217,-10.6254
1373-0,Will the U.N. Human Rights Council (UNHRC) adopt a resolution *directly concerning Sri Lanka during its 25th regular session in March 2014?,18.8463,-9.58237
1376-0,"Will Argentina, Brazil, India, Indonesia, Turkey, and/or South Africa impose *currency or capital controls before 1 May 2014?",0.656738,-2.2591
1378-0,Will the European Union and/or the U.S. impose new *sanctions on Viktor Yanukovich and/or members of his government before 10 May 2014? ,3.66308,-1.83572
1379-6,When will Yingluck Shinawatra vacate the office of Prime Minister of Thailand?,-22.5075,23.8728
1383-0,Who will win the April 2014 presidential elections in Afghanistan?,-21.6359,-3.88222
1386-0,Will Recep Tayyip Erdogan vacate the office of Prime Minister of Turkey before 10 May 2014?,-23.0837,21.6896
1388-6,What will be the highest daily close for the U.S. dollar-Ukrainian hryvnia exchange rate between 5 March 2014 and 1 May 2014?,-9.50242,-19.0219
1391-0,Will there be a *significant lethal confrontation between armed forces from Russia and Ukraine in Crimea before 1 April 2014?,26.7132,-1.16881
1392-0,Will *Russian armed forces invade or enter Kharkiv and/or Donetsk before 1 May 2014?,25.2795,7.40909
1393-0,"Will Bahrain, Egypt, Saudi Arabia, or the United Arab Emirates return their ambassadors to Qatar before 10 May 2014?",-6.54703,8.9935
1394-0,"Before 31 December 2014, will China *seize control of Second Thomas Shoal?",27.2915,-0.413519
1396-6,"Between 29 May 2011 and 3 May 2014, how many fatalities in Nigeria will be attributed to Boko Haram?",1.54437,-19.0015
1397-0,"Before 1 May 2014, will the government of Myanmar sign a nationwide ceasefire agreement with the Nationwide Ceasefire Coordination Team (NCCT)?",2.37868,1.90504
1398-0,Will Parti Quebecois hold a majority of seats in the Quebec legislature after the 2014 provincial election?  ,-21.7723,1.4017
1399-1,Will a referendum on Quebec's affiliation with Canada be held before 31 December 2014?,-13.3344,0.297985
1399-2,Will a referendum on Quebec's affiliation with Canada be held before 31 December 2014?,-12.3617,1.12575
1400-0,Will China's *official annual GDP growth rate be less than 7.5 percent in Q1 2014?,-10.9243,-15.994
1401-0,"Before 10 May 2014, will Russia agree to conduct a joint naval exercise with Iran?",14.1277,2.19526
1402-1,"Between 2 April 2014 and 10 May 2014, will Russia *officially *annex any *additional Ukrainian territory?",3.80781,-19.7063
1402-2,"Between 2 April 2014 and 10 May 2014, will Russia *officially *annex any *additional Ukrainian territory?",2.97091,-20.0144
1403-0,Will Iran and the P5+1 countries *officially announce an agreement regarding the Arak reactor before 10 May 2014?,1.71971,3.9389
1405-0,Will Nouri al-Maliki's State of Law bloc win more seats than any other entity in the 2014 parliamentary elections in Iraq?,-20.3027,-0.181049
1406-0,Will Iran and Russia *officially sign an agreement regarding the exchange of oil for *goods and services before 10 May 2014?,8.35492,1.57617
1408-6,How many *additional countries will report *cases of the Ebola virus as of 9 May 2014?,0.73564,-19.4101
1409-0,Will a runoff be required in Brazil's 2014 presidential election?,-22.4368,-5.0965
1410-0,Will an independence referendum *pass in Scotland?,-12.5768,1.99272
1411-1,Will North Korea test a *long-range missile **before 1 June 2015?,16.252,3.06936
1411-2,Will North Korea test a *long-range missile **before 1 June 2015?,15.9604,3.47558
1412-0,Will the TOPIX Index close at or below 1200.00 **between 20 August 2014 and 31 October 2014?,-11.9994,-22.7549
1413-0,Will the Kurdistan Regional Government *hold a referendum on national independence **before 1 January 2015?,-15.2185,-0.144775
1414-0,"On 15 September 2014, will the Arctic sea ice extent be less than that of 15 September 2013?",-5.18349,-16.2348
1415-0,Will there be a **lethal confrontation involving Russian **national military forces in Ukraine **before 1 October 2014?,28.7559,-1.76798
1416-0,Will North Korea detonate a nuclear device **before 1 January 2015?,15.1698,3.58229
1417-0,"Will Kim Jong Un meet a *head of state from one of the G7 countries, South Korea, China, or Russia **before 1 June 2015?",3.91401,18.2843
1418-0,Will Afghanistan sign a Bilateral Security Agreement with the United States **before 1 November 2014?,4.69514,-0.697492
1419-1,Will the World Trade Organization's Trade Facilitation Agreement (TFA) protocol be approved by all WTO members **before 1 January 2015?,15.2631,-22.7549
1419-2,Will the World Trade Organization's Trade Facilitation Agreement (TFA) protocol be approved by all WTO members **before 1 January 2015?,15.0943,-22.8392
1420-0,Will China officially declare an *Air-Defense Identification Zone (ADIZ) over the South China Sea **before 1 June 2015?,25.1421,-3.17213
1421-0,Will the New Development Bank **officially announce that a loan will be made to a country **before 1 June 2015?,12.3752,-15.7749
1422-0,Will Islamic State (IS) fighters **attack a country other than Iraq or Syria **between 27 August 2014 and 15 October 2014?,23.803,5.39918
1423-0,Will China **officially announce a *peak year for its carbon emissions **before 1 June 2015?,-3.30952,10.2378
1424-0,Will the highest end-of-day close for the U.S. dollar-Russian ruble exchange rate exceed 38.00 **between 3 September 2014 and 30 November 2014?,-9.93587,-18.2715
1425-0,"Will ambassadors from Bahrain, Saudi Arabia, or the United Arab Emirates officially return to their posts in Qatar **before 1 June 2015?",-6.0687,7.78881
1426-6,How many European banks will *fail the European Central Bank's *comprehensive assessment?,15.9695,-23.6534
1427-0,Will Russia officially annex any *additional Ukrainian territory **before 1 January 2015?,3.05418,-20.3284
1428-0,Will Nawaz Sharif **vacate the office of Prime Minister of Pakistan **before 1 January 2015?,-23.5093,22.5045
1429-0,Will **national military force(s) from one or more countries *intervene in Syria **before 1 December 2014?,24.0435,5.52582
1430-0,Will there be a **lethal confrontation between China's **national military forces and the **national military forces of another country in the South China Sea region **before 1 June 2015?,29.1852,-1.21977
1431-0,"**As of 24 November 2014, how many centrifuges for uranium activity will Iran have agreed to operate?",2.48065,-19.1726
1432-0,Will the VSTOXX Index close at or above 23.00 **before 1 May 2015?,-11.9107,-23.3758
1433-0,Will the Oil Volatility Index (OVX) close at or above 25.00 **before 5 June 2015?,-13.127,-21.9229
1434-0,"**Before 1 January 2015, will Bulgaria **officially announce that work on the South Stream Pipeline project will resume?",2.3957,13.6179
1435-0,Will NATO invite any new countries to join the *Membership Action Plan (MAP) **before 1 June 2015?,14.6125,-20.3465
1436-6,How many Eurozone banks will fail the European Central Bank's *comprehensive assessment?,15.8356,-23.7646
1437-0,"**Before 1 June 2015, will the Mangyongbong-92 **officially resume transit between North Korea and Japan?",4.43387,16.9126
1438-0,"**Before 1 April 2015, will Russia *initiate a World Trade Organization (WTO) dispute against the European Union, Canada, or the United States?",12.5827,-19.7001
1439-6,By how much will Brazil's *economy grow in 2014?,0.499152,-19.7001
1440-0,Will Mahmoud Abbas **vacate the office of President of the Palestinian Authority **before 1 June 2015?,-17.521,21.4869
1441-6,When will the United Kingdom **officially appoint an ambassador to Iran?,-5.51062,4.79965
1442-0,Will the World Health Organization report any *confirmed cases of Ebola in a European Union member state **before 1 June 2015?,12.9945,-18.8359
1443-0,"Will the Islamic State **attack Bahrain, Jordan, Qatar, Saudi Arabia, or the United Arab Emirates **before 1 February 2015?",-6.98061,8.90357
1444-6,"When will a trilateral meeting take place between Chinese President Xi Jinping, Japanese Prime Minister Shinzo Abe, and South Korean President Park Geun-hye?",-19.3038,23.7047
1445-6,What will be the highest end-of-day close for the U.S. dollar-Chinese renminbi exchange rate **between 1 October 2014 and 1 February 2015?,-10.0139,-18.7702
1446-6,"When will Russia **officially lift its embargo on food imports from the US, the EU, Canada, Australia or Norway?",-11.8942,1.4807
1447-0,Will construction on the Nicaragua Canal begin **before 1 January 2015?,-2.92004,5.03364
1448-1,Will Hong Kong Chief Executive Leung Chun-ying **vacate office **before 1 February 2015?,-21.8586,26.541
1448-2,Will Hong Kong Chief Executive Leung Chun-ying **vacate office **before 1 February 2015?,-21.7673,26.669
1449-0,Will the People's Armed Police or the People's Liberation Army respond to protests in Hong Kong **before 1 December 2014?,13.5289,13.7821
1450-0,Will OPEC agree to cut its oil output at or before its 27 November 2014 meeting?    ,8.46971,11.8466
1451-6,When will the Foreign Secretaries from India and Pakistan hold **official talks?,0.485011,17.5529
1452-6,"**As of 1 June 2015, in how many of the following countries (Sierra Leone, Guinea, and Liberia) will the Ebola outbreak be *contained?",1.37909,-16.8527
1453-0,Which country (or countries) will **officially join the Asian Infrastructure Investment Bank before or at the Asia-Pacific Economic Cooperation (APEC) meeting?,13.2332,-20.8232
1454-0,Will Germany **officially report a negative GDP growth rate for the third quarter of 2014?,-10.8735,-17.3016
1455-0,Will Iran host a *head of state from one of the G8 countries or China on an official visit **before 1 June 2015?,-2.89213,-12.6588
1456-6,By how much will Chinese power consumption *grow in 2014?,16.4703,13.0532
1457-0,Will a *no-fly zone over any part of Syria be **officially announced **before 1 March 2015?,16.8231,-8.60638
1458-0,Who will win the **election for governor in Japan's Okinawa prefecture?,-24.2948,-5.30224
1459-0,Will Goodluck Jonathan **vacate the office of President of Nigeria **before 10 June 2015?,-21.4455,24.0636
1460-0,Will 2014 be Earth's warmest calendar year *on record?,17.0449,0.786901
1461-0,Will there be a *significant **lethal confrontation between **national military forces from Iran and Pakistan **before 15 December 2014?,26.2391,-0.90983
1462-0,"**Before 10 June 2015, will Iraq's parliament approve the creation of an Iraqi National Guard?",6.03485,1.73049
1463-6,When will Iran release Jason Rezaian?,-7.08035,-8.12368
1464-0,"**Before 1 January 2015, will the spot price of iron ore fall below US$71.00 per ton?",-13.4688,-23.0358
1465-6,When will **national or **multinational military forces *intervene against the Forces Democratiques de Liberation du Rwanda (FDLR) in the Democratic Republic of Congo?,28.5585,7.12821
1466-0,"**Before 10 June 2015, will NATO invoke Article 5 of the North Atlantic Treaty?",-1.47594,-1.8083
1467-1,Will negotiations on the Trans-Pacific Partnership (TPP) be completed **before 10 June 2015?,14.148,-22.176
1467-2,Will negotiations on the Trans-Pacific Partnership (TPP) be completed **before 10 June 2015?,14.6109,-21.9475
1468-6,When will France deliver a Mistral-class ship to Russia?,-4.39916,-1.819
1469-0,What will the United Nations Security Council do with regard to the resolution referring the situation in North Korea to the International Criminal Court (ICC)? ,1.10804,-9.63159
1470-6,When will Mariano Rajoy **vacate the office of Prime Minister of Spain?,-23.0237,23.8485
1471-6,When will Russia next launch an intercontinental ballistic missile (ICBM)?,17.0865,2.45857
1472-1,Will negotiations on the Transatlantic Trade and Investment Partnership (TTIP) be completed **before 10 June 2015?,16.1397,-22.6671
1472-2,Will negotiations on the Transatlantic Trade and Investment Partnership (TTIP) be completed **before 10 June 2015?,16.0349,-22.0924
1473-6,When will a free trade agreement between India and Israel be **officially reached?,15.4741,-18.0041
1474-0,Will Benjamin Netanyahu **vacate the office of Prime Minister of Israel **before 1 May 2015?,-22.5537,20.3639
1475-0,Will the HSBC Saudi Arabia Purchasing Managers' Index fall to 50 or below **before 1 June 2015?,-9.53061,-22.4637
1476-0,"**Before 1 May 2015, will Standard & Poor's downgrade Russia's foreign currency credit rating to BB+ or below?",-8.43753,-5.77099
1477-0,"**Before 10 June 2015, will the IMF **officially announce that the Chinese renminbi will be added to its Special Drawing Rights (SDR)?",3.67862,-8.94192
1478-0,Will China allow any members of the UK Parliament's Foreign Affairs Committee to enter Hong Kong **before 1 March 2015?,14.142,14.4758
1479-6,When will there be a new *confirmed case of Ebola in Nigeria?,-11.9778,-2.71885
1480-0,Will Russia **officially withdraw from the Intermediate-Range Nuclear Forces (INF) Treaty **before 10 June 2015?,-11.7391,1.16338
1481-6,How many *new countries will confirm cases of the H5N8 virus **between 10 December 2014 and 1 April 2015?,3.47538,-16.2253
1482-0,Will Jordan experience an episode of **significant domestic political unrest **between 10 December 2014 and 1 June 2015?,14.4139,13.1026
1483-0,Will the Syriza party be in the majority governing coalition in Greece's Parliament after the 25 January 2015 general **elections?,-19.3864,1.73077
1484-0,Will the International Monetary Fund's April 2015 World Economic Outlook report show that the annual percent change in world economic output for 2014 was less than 3.3%?,3.36269,-12.3528
1485-6,When will Venezuela default on its foreign-currency debt?,-8.94568,-5.26484
1486-0,Will Cuba experience an episode of **significant domestic political unrest **between 7 January and 1 June 2015?,13.0965,12.3157
1487-0,Will there be a **lethal confrontation between **national military forces in the East China Sea **before 10 June 2015?,28.9137,-2.21376
1488-6,When will the end-of-day close for the U.S. dollar - Russian ruble exchange rate be 45.00 or below?,-10.8473,-18.5636
1489-6,When will Russia and China hold joint naval exercises in the Mediterranean Sea?,14.1488,1.29521
1490-0,"**Before 1 June 2015, will the People's Bank of China reach a bilateral currency swap **agreement with the United States Federal Reserve?",8.02976,-1.30198
1491-6,How many countries will **officially submit a claim to the North Pole to the United Nations **between 14 January and 9 June 2015?,9.14404,-0.924956
1492-6,When will the government of Myanmar **officially sign a ceasefire agreement with the Nationwide Ceasefire Coordination Team?,1.98772,2.70038
1493-6,When will Petrobras report its earnings for the third quarter of 2014? ,-7.03035,-5.61543
1494-0,"Will there be an **attack carried out by Islamist militants in France, the UK, Germany, the Netherlands, Denmark, Spain, Portugal, or Italy **between 21 January and 31 March 2015?",-13.7107,16.5536
1495-6,When will a new round of family reunions between North and South Korea begin?,5.3545,22.2389
1496-0,Will South Korean President Park Geun-hye or any South Korean *cabinet minister meet with **official North Korean representatives **before 1 April 2015?,4.85072,24.3368
1497-0,Will Iran experience an episode of **significant domestic political unrest **between 21 January and 1 June 2015?,11.5957,11.5758
1498-0,Will the Conservative party hold more seats than any other party in the UK House of Commons after the 7 May 2015 **elections?,-20.3012,0.668654
1499-0,Will a unity government be formed in Libya **before 1 June 2015?,10.2345,2.64654
1500-6,When will **Standard and Poor's downgrade Greece's sovereign credit rating?,-9.40978,-6.02679
1501-0,Will Israeli Prime Minister Netanyahu speak before the U.S. Congress **before 15 March 2015?,-21.2655,19.7059
1502-0,"**Before 1 April 2015, will there be a **lethal confrontation between Saudi **national military forces and Yemen's Houthis?",29.6909,-2.04891
1503-6,"**Between 4 February and 30 April 2015, what will be the lowest end-of-day spot price per dry metric ton of 62% Fe iron ore?",-13.4197,-22.8333
1504-0,"**Before 10 June 2015, will it be **officially announced that any country is exiting the eurozone or the European Union?",12.2844,-16.2785
1505-0,Will Ethiopia experience an episode of **sustained domestic armed conflict **between 4 February and 1 June 2015?,11.8861,11.6241
1506-0,Will the HSBC China Services Purchasing Managers' Index fall to 50.0 or below **before 1 June 2015?,-11.2522,-22.4549
1507-0,Will the end-of-day close for the euro-dollar exchange rate fall to $1.10 or below **between 11 February and 1 May 2015?,-11.209,-21.0708
1508-0,Will China conduct naval exercises in the Pacific Ocean beyond the *first island chain **before 1 June 2015?,15.7789,1.8829
1509-0,Will the state of emergency in the Sinai be lifted on or before 25 April 2015?,2.98643,-1.34279
1510-0,Will Russia experience an episode of **significant domestic political unrest **between 11 February and 1 June 2015?,11.7185,11.0869
1511-6,When will any member of the P5+1 **officially announce the imposition of *further sanctions on Iran?,10.6699,-18.1823
1512-0,Will North Korea and Russia conduct joint military exercises **before 10 June 2015?,15.5792,3.04571
1513-0,Will Cristina Fernandez de Kirchner **vacate the office of President of Argentina **before 1 June 2015?,-21.0294,25.1035
1514-0,Will Iran's President Hassan Rouhani meet Saudi Arabia's King Salman bin Abdulaziz Al Saud **before 1 June 2015?,-8.40359,10.0512
1515-0,"**Before 1 June 2015, will SWIFT restrict any Russian banks from accessing its services? ",9.10355,0.097903
1516-0,Will voting in Nigeria's presidential **election begin on 28 March 2015?,-20.2807,-4.90249
1517-6,When will the end-of-day price for the Oil Volatility Index (OVX) fall to 40 or below?,-13.3291,-22.1163
1518-6,When will Nicolas Maduro **vacate the office of President of Venezuela?,-18.4415,18.9582
1519-0,Will Iran purchase an Antey-2500 anti-ballistic missile system from Russia **before 10 June 2015?,15.3475,2.46076
1520-0,Will there be a **lethal confrontation between Chinese and Indian **national military forces **before 1 June 2015?,28.0228,-2.82075
1521-6,When will *any agreement regarding Iran's nuclear program be **officially announced by Iran and the P5+1?,-0.802741,4.07747
1522-0,"**Between 11 March and 1 June 2015, will the People's Bank of China **officially announce that the yuan's trading band against the dollar has been widened?",10.0898,-10.079
1523-6,"What will be the lowest public approval rating for Russian President Vladimir Putin, according to the Levada Center, **between 11 March and 1 June 2015?",-10.3286,-21.9634
1524-0,Will Tony Abbott **vacate the office of Prime Minister of Australia **before 1 June 2015?,-20.5714,23.8271
1525-0,Will Iran release Jason Rezaian **before 10 June 2015?,-6.79826,-8.46676
1526-0,"**Between 18 March and 1 June 2015, which country (or countries) will **officially announce that it will join the Asian Infrastructure Investment Bank (AIIB)?",14.0311,-20.2079
1527-0,"**Between 18 March and 1 May 2015, will the European Commission, the European Central Bank, or the IMF agree to release any bailout funds to Greece?",13.6284,-18.9827
1528-6,What will be the lowest end-of-day close for the euro-dollar exchange rate **between 18 March and 9 June 2015?,-11.5594,-21.346
1529-0,Will the government of Afghanistan and any faction of Afghanistan's Taliban participate in **official talks **before 10 June 2015?,1.23685,19.7622
1530-6,What percentage of the vote will the United Kingdom Independence Party (UKIP) earn in the 7 May 2015 **elections?,-14.2639,0.360575
1531-6,When will foreign **national military forces launch a ground offensive against Houthi rebels in Yemen?,30.083,-0.824673
1532-0,Will South Korean President Park Geun-hye or any South Korean *cabinet minister meet with **official North Korean representatives **between 1 April and 9 June 2015?,4.78409,23.8733
1533-0,Will Brazil's President Dilma Rousseff **vacate office or *be impeached **before 10 June 2015?,-23.0499,25.0145
1534-6,"What will be the lowest closing spot price for West Texas Intermediate (WTI) crude oil, according to the U.S. Energy Information Agency, **between 1 April and 9 June 2015?",-11.3278,-21.9797
1535-0,Will Islamic State leader Abu Bakr al-Baghdadi be *incapacitated **before 10 June 2015?,-12.704,8.25052
1536-6,What will be the highest end-of-day close for the U.S. dollar-Chinese renminbi exchange rate **between 8 April and 1 June 2015?,-10.3075,-19.0219
1537-0,Will Russia release Eston Kohver **before 10 June 2015?,17.133,1.06716
1538-0,"**Before 10 June 2015, will North Korea release either of the South Korean citizens identified as Kim Guk-gi and Choi Chun-gil?",5.35943,22.8692
1539-0,Will the UN Security Council adopt a resolution imposing an arms embargo on South Sudan **before 10 June 2015?,19.1678,-7.91517
1540-0,"**Before 10 June 2015, will Ukraine **officially announce that it will hold a referendum on the structure of its government?",1.12458,7.04636
